{
  "schema_version": "1.0.0",
  "destinatario": {
    "nombre": {
      "valor": "Aurora Ficticia",
      "fuente": {
        "entrada": "ent-01",
        "cita": "Se llama Aurora Ficticia"
      }
    },
    "edad": null,
    "rasgos": [
      {
        "valor": "valiente",
        "fuente": {
          "entrada": "ent-01",
          "cita": "Es valiente"
        }
      },
      {
        "valor": "paciente",
        "fuente": {
          "entrada": "ent-01",
          "cita": "siempre fue paciente con todos"
        }
      }
    ]
  },
  "recuerdos": [],
  "genero": {
    "valor": "domestic_suspense",
    "fuente": {
      "entrada": "ent-01",
      "cita": "Suspense doméstico"
    }
  },
  "tono": {
    "valor": "tierno",
    "fuente": {
      "entrada": "ent-01",
      "cita": "Tierno, con algo de humor"
    }
  },
  "extension": {
    "valor": "media",
    "fuente": {
      "entrada": "ent-01",
      "cita": "Media"
    }
  },
  "prohibidos": null,
  "preguntas": []
}
